{"$schema":"https://json-schema.org/draft/2020-12/schema","$id":"https://anomaly.local/gmcp-contract/1.0.0/Anomaly.Mob.Info.json","title":"Anomaly.Mob.Info","description":"Static snapshot (A.4): sent only when the client does not hold it (A.9). Never resent on HP changes. Evicted on Mob.Gone died/despawned, Reset all, Reset package Anomaly.Mob, a new boot.","x-direction":"s2c","x-frozen":false,"type":"object","properties":{"uid":{"type":"integer","minimum":1,"description":"monster runtime id, unique within one server start (boot)"},"tpl":{"type":"integer"},"name":{"type":"string"},"display":{"type":"string"},"level":{"oneOf":[{"type":"null"},{"type":"object","properties":{"min":{"type":"integer","minimum":0},"max":{"type":"integer","minimum":0}},"required":["min","max"],"additionalProperties":false}],"description":"null: the game data carries no level for monsters (MajorMUD has none). A calculated level band may be added in a later MINOR version, labelled as calculated (A.5)."},"exp":{"type":"integer","minimum":0},"ac":{"type":"integer"},"dr":{"type":"integer"},"mr":{"type":"integer"},"bsDefense":{"type":"integer"},"dodge":{"type":"integer"},"accuracy":{"type":"integer"},"attacks":{"type":"array","items":{"type":"object","properties":{"name":{"type":"string"},"type":{"enum":["melee","spell","steal","other"]},"min":{"type":"integer"},"max":{"type":"integer"},"chance":{"type":"integer","minimum":0},"energy":{"type":"integer","minimum":0},"spell":{"type":["integer","null"]}},"required":["name","type","min","max","chance","energy","spell"],"additionalProperties":false}},"spells":{"type":"array","items":{"type":"object","properties":{"id":{"type":"integer"},"name":{"type":"string"},"chance":{"type":"integer","minimum":0}},"required":["id","name","chance"],"additionalProperties":false}},"resists":{"type":"object","properties":{"fire":{"type":"integer"},"cold":{"type":"integer"},"lightning":{"type":"integer"},"stone":{"type":"integer"},"water":{"type":"integer"}},"required":["fire","cold","lightning","stone","water"],"additionalProperties":false},"nature":{"type":"object","properties":{"undead":{"type":"boolean"},"animal":{"type":"boolean"},"living":{"type":"boolean"}},"required":["undead","animal","living"],"additionalProperties":false},"alignment":{"type":"integer"},"followPct":{"type":"integer","minimum":0},"charmResist":{"type":"integer"},"regen":{"type":"integer"},"drops":{"type":"array","items":{"type":"object","properties":{"item":{"type":"integer"},"name":{"type":"string"},"pct":{"type":"integer","minimum":0}},"required":["item","name","pct"],"additionalProperties":false}},"coins":{"type":"object","properties":{"runic":{"type":"integer","minimum":0},"platinum":{"type":"integer","minimum":0},"gold":{"type":"integer","minimum":0},"silver":{"type":"integer","minimum":0},"copper":{"type":"integer","minimum":0}},"required":["runic","platinum","gold","silver","copper"],"additionalProperties":false}},"required":["uid","tpl","name","display","level","exp","ac","dr","mr","bsDefense","dodge","accuracy","attacks","spells","resists","nature","alignment","followPct","charmResist","regen","drops","coins"],"additionalProperties":false}
