{"uid":102,"tpl":12,"name":"giant rat","display":"large giant rat","level":null,"exp":20,"ac":5,"dr":0,"mr":0,"bsDefense":0,"dodge":5,"accuracy":20,"attacks":[{"name":"bite","type":"melee","min":1,"max":4,"chance":100,"energy":300,"spell":null}],"spells":[],"resists":{"fire":0,"cold":0,"lightning":0,"stone":0,"water":0},"nature":{"undead":false,"animal":true,"living":true},"alignment":0,"followPct":0,"charmResist":0,"regen":1,"drops":[{"item":23,"name":"rat tail","pct":30}],"coins":{"runic":0,"platinum":0,"gold":0,"silver":2,"copper":15}}
